John S. Atkinson,"Affiliated Systems, 3104 Edloe, Suite 330; Houston, TX 77027-6022, USA"
Jerry W. Carlson,"Affiliated Systems, 3104 Edloe, Suite 330; Houston, TX 77027-6022, USA"
Raymond V. Liedka,"Department of Sociology, University of New Mexico, Albuquerque, NM 87131, USA"
Carolyn J. Anderson,"Department of Educational Psychology, University of Illinois at Urbana-Champaign, USA"
Stanley Wasserman,"Department of Psychology, University of Illinois at Urbana-Champaign, USA"
Bradley Crouch,"Department of Psychology, University of Illinois at Urbana-Champaign, USA"
Jennifer A. Stoloff,"Department of Sociology, University of North Carolina, Chapel Hill, NC 27599-3210, USA"
Jennifer L. Glanville,"Department of Sociology, University of North Carolina, Chapel Hill, NC 27599-3210, USA"
Elisa Jayne Bienenstock,"Department of Sociology, Stanford University, Stanford, CA 94305-2047, USA"
Karen Klein Ikkink,"Vrije Universiteit, Vrije University Amsterdam, Social Studies, Department of Sociology and Social Gerontology, de Boelelaan 1081c, 1081 HV Amsterdam, Netherlands"
Nicholas V. Findler,"Department of Computer Science and the Artificial Intelligence Lab., Arizona State University, Tempe, AZ 85287-5406, USA"
Sudheer Dhulipalla,"Department of Computer Science and the Artificial Intelligence Lab., Arizona State University, Tempe, AZ 85287-5406, USA"
Jooske T. van Busschbach,"Department of Statistics, Measurement Theory and Information Technology, University of Groningen, Grote Kruisstraat 2/1, 9712 TS Groningen, Netherlands"
R. Neelamegham,"The University of Colorado, CO, USA"
Nigel Hopkins,
Brigham S. Anderson,"Department of Robotics, Carnegie Mellon University, Pittsburgh, PA, USA"
Stefanie Bailey,"Department of Sociology, Stanford University, Stanford, CA 94305, USA"
Stephen J. Walsh,"Department of Geography, University of North Carolina, Chapel Hill, NC, USA"
Yothin Sawangdee,"Institute for Population and Social Research, Mahidol University, Salaya, Thailand"
Ingegerd Jansson,"Department of Statistics, Stockholm University, 106 91 Stockholm, Sweden"
Cynthia M. Webster,"School of Marketing, University of New South Wales, Sydney, NSW 2052, Australia"
Hugh Louch,"Princeton University, Princeton, NJ 08544, USA"
Sabina Kef,"Department of Education, University of Amsterdam, Amsterdam, The Netherlands"
Joop J. Hox,"Department of Education, University of Amsterdam, Amsterdam, The Netherlands"
H. T. Habekothé,"Department of Education, University of Amsterdam, Amsterdam, The Netherlands"
Bruce C. Straits,"Department of Sociology, University of California - Santa Barbara, Santa Barbara, CA 93106-9430, USA"
Robert P. Gilles,"Department of Economics, Virginia Polytechnic Institute and State University, Blacksburg, VA 24061, USA"
Robert Poulin,"CHA, Pavillon St. Sacrement, Groupe de Recherche en Épidémiologie, 1050 Chemin Ste-Foy, Québec, Québec, Canada G1S 4L8"
Marie-Claude Boily,"CHA, Pavillon St. Sacrement, Groupe de Recherche en Épidémiologie, 1050 Chemin Ste-Foy, Québec, Québec, Canada G1S 4L8"
Benoît R. Mâsse,"CHA, Pavillon St. Sacrement, Groupe de Recherche en Épidémiologie, 1050 Chemin Ste-Foy, Québec, Québec, Canada G1S 4L8"
Robb Willer,"Department of Sociology, University of Iowa, Iowa City, IA 52242 USA"
Micha Mandel,"Department of Statistics, The Hebrew University, Jerusalem, Israel"
J. Jill Suitor,"Department of Sociology, Louisiana State University, Baton Rouge, LA 70803, USA"
Karl Pillemer,"Cornell University, Ithaca, NY 14853, USA"
Kevin White 0002,"Population Studies Center, University of Pennsylvania, Philadelphia, PA, USA"
Susan Cotts Watkins,"Population Studies Center, University of Pennsylvania, Philadelphia, PA, USA"
Britta Ruhnau,"Department of Operations Research, Universität Dortmund, University of Dortmund, D-44221 Dortmund, Germany"
Peter Elliott,"Department of Psychology, Swinburne University of Technology, Hawthorn, Vic. 3122, Australia"
Kai J. Jonas,"Georg-August-Universitaet, Goettingen 37073, Germany"
Min-Woong Sohn,"Department of Health Studies, The University of Chicago, 5841 S Maryland Avenue MC 2007, Chicago, IL 60637 1470, USA"
Michael Bourgeois,"Department of Sociology, University of California - Santa Barbara, CA 93106, USA"
Willem E. Saris,"University of Amsterdam, Amsterdam, The Netherlands"
Odalia Wong,"Department of Sociology, Hong Kong Baptist University, Kowloon Tong, Kowloon, Hong Kong"
Brian McCue,"4915 Cherokee Avenue, Alexandria, VA 22312, USA"
Martin Ruef,"Department of Sociology, University of North Carolina, Chapel Hill, NC 27599-3210, USA"
Devon D. Brewer,"Alcohol and Drug Abuse Institute, University of Washington, 1107 NE 45th Street, Suite 120, Washington, WA 98105-4631, USA"
Susan C. Weller,"University of Texas Medical Branch, Gelveston, USA"
John M. Roberts Jr.,"Department of Sociology, University of New Mexico, Albuquerque, NM 87131, USA"
Timothy J. Brazill,"Department of Sociology, Mercer University, 1400 Coleman Avenue, Macon, GA 31207, USA"
Bernard Grofman,"School of Social Sciences, University of California - Irvine, Irvine, CA, USA"
Karin E. Willert,"Department of Sociology, University of South Carolina, Columbia, SC 29208, USA"
David D. Rowlee,"Department of Sociology, University of South Carolina, Columbia, SC 29208, USA"
Ece Batchelder,"School of Social Sciences and Institute for Brain Aging and Dementia, University of California - Irvine, Irvine, CA 92697, USA"
Martin Kilduff,"Department of Management and Organization, Smeal College of Business Administration, The Pennsylvania State University, University Park, PA 16802, USA"
Jeffrey C. Johnson,"Department of Sociology, East Carolina University, Brewster A-416, 10th Street, Greenville, NC 27858, USA"
Michael K. Orbach,"Duke University, Durham, NC, USA"
William C. Carter,"Cecil G. Sheps Center for Health Services at the University of North Carolina, Chapel Hill, NC, USA"
Ove Frank,"Department of Statistics, Stockholm University, S-10691 Stockholm, Sweden"
Norman P. Hummon,"Department of Sociology, University of Pittsburgh, 2J22 Wesley W. Posvar Hall, Pittsburgh, PA 15260, USA"
Maarten Marx,"Language and Inference Technology Group, ILLC, Universiteit van Amsterdam, University of Amsterdam, Nieuwe Achtergracht 166, 1018 WV Amsterdam, The Netherlands"
Michael Masuch,"Language and Inference Technology Group, ILLC, Universiteit van Amsterdam, University of Amsterdam, Nieuwe Achtergracht 166, 1018 WV Amsterdam, The Netherlands"
Hester H. S. Moerbeek,"Department of Sociology of Consumers and Households, Wageningen University, Wageningen, The Netherlands"
Mark E. J. Newman,"Santa Fe Institute, 1399 Hyde Park Road, Santa Fe, NM 87501, USA"
Gianluca Carnabuci,"Department of Sociology and Anthropology, Universiteit van Amsterdam, University of Amsterdam, Oudezijds Achterburgwal 185, 1012 DK Amsterdam, The Netherlands"
Ivar E. Vermeulen,"Applied Logic Laboratory, Universiteit van Amsterdam, University of Amsterdam, Nieuwe Achtergracht 166, 1018 VW Amsterdam, The Netherlands"
John Domini,"University of Florida, Gainesville, FL, USA"
Gene A. Shelley,"Georgia State University, Atlanta, GA, USA"
George R. Barnes,"Department of Mathematics, University of Louisville, Louisville, KY 40292, USA"
Patricia B. Cerrito,"Department of Mathematics, University of Louisville, Louisville, KY 40292, USA"
Inessa Levi,"Department of Mathematics, University of Louisville, Louisville, KY 40292, USA"
Jukka Nyblom,"Department of Statistics, University of Joensuu, P.O. Box 111, 80101 Joensuu, Finland"
Juha Roslakka,"Department of Social Policy, University of Joensuu, P.O. Box 111, 80101 Joensuu, Finland"
Mikko A. Salo,"Department of Social Policy, University of Joensuu, P.O. Box 111, 80101 Joensuu, Finland"
Shin-Kap Han,"Department of Sociology, University of Illinois at Urbana-Champaign, 326 Lincoln Hall, MC-454, Urbana, IL 61801, USA"
Kazuo Yamaguchi,"Department of Sociology, University of Chicago, 1126 E 59th Street, Chicago, IL 60637, USA"
William S. Lovejoy,"Business School, University of Michigan, 701 Tappan, Ann Arbor, MI 48109, USA"
Christoph H. Loch,"HP Labs, 1501 Page Mill Road, Palo Alto, CA 94304, USA"
Deirdre M. Kirke,"Department of Sociology, National University of Ireland, Maynooth, Co. Kildare, Ireland"
Dianne A. Van Hemert,"Department of Psychology, Tilburg University, Tilburg, The Netherlands"
Robert R. Faulkner,"University of Massachusetts, MA, USA"
Thomas J. Fararo,"University of Pittsburgh, Pittsburgh, PA, USA"
Frits van Merode,"Department of Health Organization, Policy and Economics, Maastricht University, P.O. Box 616, 6200 MD Maastricht, The Netherlands"
Anna Nieboer,"Institute of Health Policy and Management, Erasmus MC, P.O. Box 1738, 3000 DR Rotterdam, The Netherlands"
Hans Maarse,"Department of Health Organization, Policy and Economics, Maastricht University, P.O. Box 616, 6200 MD Maastricht, The Netherlands"
Harm Lieverdink,"CTU, P.O. Box 459, 1180 AC Amstelveen, The Netherlands"
Fredrik Liljeros,"Department of Sociology, Stockholm University, S-106 91 Stockholm, Sweden"
María Guadalupe Ramírez Ortiz,"Epidemiological Research and Adolescence Health Center Unit; Mexican Institute of Social Security, UMF No. 93, IMSS, Av. Tonla 121, CP 45 400 Tonala, Jalisco, Mexico"
José Ramiro Caballero Hoyos,"Epidemiological Research and Adolescence Health Center Unit; Mexican Institute of Social Security, UMF No. 93, IMSS, Av. Tonla 121, CP 45 400 Tonala, Jalisco, Mexico"
María Guadalupe Ramírez López,"Epidemiological Research and Adolescence Health Center Unit; Mexican Institute of Social Security, UMF No. 93, IMSS, Av. Tonla 121, CP 45 400 Tonala, Jalisco, Mexico"
Annie Cody Holdren,"Department of Sociology, University of California - Los Angeles, 2201 Hershey Hall, P.O. Box 951551, CA 90095-1551, USA"
Michael Johnston,"Department of Sociology, University of California - Los Angeles, 2201 Hershey Hall, P.O. Box 951551, CA 90095-1551, USA"
Christian Tallberg,"Department of Statistics, Stockholm University, Stockholm, Sweden"
Jodie Woolcock,"Department of Psychology, School of Behavioural Science, University of Melbourne, Melbourne, Vic. 3010, Australia"
Masaki Tomochi,"Faculty of Policy Studies, Chuo University, 742-1 Hachioji, Tokyo 192-0393, Japan"
W. Craig Carter,"Department of Sociology and Anthropology, Middle Tennessee State University, Murfreesboro, TN 37129, USA"
Scott L. Feld,"Department of Sociology and Anthropology, Purdue University, West Lafayette, IN 47907, USA"
George A. Barnett,"Department of Communication, School of Informatics, University at Buffalo (SUNY), 331 Baldy Hall, Buffalo, NY 14260, USA"
Rick Grannis,"Department of Sociology, University of California - Los Angeles, USA"
Elizabeth Costenbader,"Department of Population and Family Health Sciences, Johns Hopkins Bloomberg School of Public Health, Johns Hopkins University, 615 N. Wolfe St., Baltimore, MD 21205, USA"
Martin Van Der Gaag,"ICS, Free University, Amsterdam, The Netherlands"
M. E. J. Newman,"Center for the Study of Complex Systems, University of Michigan, Ann Arbor, MI 48109-1120, USA"
Barbara Zemljic,"Radiotelevision Slovenija, Kolodvorska 2, SI-1550 Ljubljana, Slovenia"
Rebecca Goolsby,"Office of Naval Research-Code 342, Cognitive, Neural, and Social S&T Division, USA"
Alden S. Klovdahl,"School of Social Sciences, Australian National University, The Faculties, Haydon-Allen 2171, Canberra, ACT 0200, Australia"
Charles Kadushin,"Cohen Center for Modern Jewish Studies and Heller School of Social Policy and Management, Brandeis University, Waltham, MA 02154, USA"
Lada A. Adamic,"HP Labs, 1501 Page Mill Road, Palo Alto, CA 94304, USA"
Eytan Adar,"HP Labs, 1501 Page Mill Road, Palo Alto, CA 94304, USA"
Simona Bignami-Van Assche,"Harvard University Initiative for Global Health, 104 Mt. Auburn Street, Cambridge, MA 02138, USA"
Rance P. L. Lee,"Department of Sociology, The Chinese University of Hong Kong, Hong Kong"
Karl M. van Meter,"LASMAS-CNRS, 59 ru Pouchet, 75017 Paris, France"
Dominique Cardon,"Laboratoire de sociologie des usages, France Télécom R&D, France"
Fabien Granjon,"Laboratoire de sociologie des usages, France Télécom R&D, France"
Christian Licoppe,"Ecole Nationale Supérieure des Télécommunications, Paris, France"
Zbigniew Smoreda,"France Télécom R&D/SUSI, 38 rue du Général Leclerc, 92794 Issy-les-Moulineaux Cedex 9, France"
Marie-Odile Lebeaux,"Ingénieur de recherche au CNRS, Lasmas, Maison de la recherche en Sciences humaines, Esplanade de la Paix, 14032 université de caen, University of Caen Cedex, France"
Daniel Lavenu,"Centre National de la Recherche Scientifique, Laboratoire d'Analyse Sociologique et des Méthodes Appliquées aux Sciences Sociales, MRSH, Université de université de caen, University of Caen, 14032 université de caen, University of Caen, France"
Norman Braun,"Department of Sociology, University of Munich, Konradstr. 6, 80801 Munich, Germany"
Thomas Gautschi,"Department of Sociology, University of Bern, Lerchenweg 36, 3000 Bern 9, Switzerland"
Hetty van Emmerik,"Utrecht University, Heidelberglaan 1, 3584 CS Utrecht, The Netherlands"
Jonathon N. Cummings,"Sloan School of Management, Massachusetts Institute of Technology, 77 Massachusetts Avenue, Cambridge, MA 02139-4307, USA"
Monica C. Higgins,"Graduate School of Business Administration, Harvard University, USA"
H. Russell Bernard,"Department of Anthropology, University of Florida, Gainesville, FL 32610, USA"
Mark House,"Bureau of Economic and Business Research, University of Florida, Gainesville, FL 32611-7145, USA"
Sam Field,"University of Texas at Austin, USA"
Kenneth A. Frank,"Room 462 Erickson Hall, Michigan State University, East Lansing, MI 48824-1034, USA"
Kathryn Schiller,"University at Albany, SUNY, USA"
Catherine Riegle-Crumb,"University of Texas at Austin, USA"
Chandra Muller,"University of Texas at Austin, USA"
Robert J. Beck,"University of California - Irvine, CA 92697, USA"
Yuki Yasuda,"Faculty of Economics, Graduate School of Economics, The University of Tokyo, 3-34-3 Hongo, Bunkyo-Ku 8F, Tokyo 113-0033, Japan"
Christopher Marquis,"Organizational Behavior Unit, Harvard Business School, Harvard University, Boston, MA 02163, USA"
Tackseung Jun,"Department of Economics, Kyung Hee University, 1 Hoegidong, Dongdaemunku, Seoul 130-701, Republic of Korea"
Jeong-Yoo Kim,"Department of Economics, Kyung Hee University, 1 Hoegidong, Dongdaemunku, Seoul 130-701, Republic of Korea"
Beom Jun Kim,"Ajou University, Seoul, Republic of Korea"
Moo Young Choi,"Seoul National University and KIAS, Seoul, Republic of Korea"
Gueorgi Kossinets,"Department of Sociology and Institute for Social and Economic Research and Policy, Columbia University, 420 W. 118th Street, 8th Floor, Mail Code 3355, New York, NY 10027, USA"
Peter V. Marsden,"Department of Sociology, Faculty of Arts and Sciences, Harvard University, 630 William James Hall, Cambridge, MA 02138, USA"
Naoki Masuda,"Laboratory for Mathematical Neuroscience, RIKEN Brain Science Institute, 2-1 Hirosawa, Wako, Saitama 351-0198, Japan"
Norio Konno,"Faculty of Engineering, Yokohama National University, 79-5 Tokiwadai, Hodogaya, Yokohama 240-8501, Japan"
Charles Carroll,"Faculty of Management and Organization, University of Groningen, P.O. Box 800, 9700 AV Groningen, The Netherlands"
King-To Yeung,"Rutgers, The State University of New Jersey, Department of Sociology, New Jersey, USA"
Alayne M. Adams,"Heilbrunn Center for Population and Family Health, Mailman School of Public Health, Columbia University, New York, NY 10032, USA"
Sangeetha Madhavan,"School of Social Sciences, University of the Witwatersrand, Johannesburg, South Africa"
Dominique Simon,"Center for Addiction Recovery, 131 Silver Lane, Sunderland, MA 01375, USA"
Margaret K. Chojnacki,"Department of Communication, School of Arts and Sciences, Barry University, 11300 NE 2nd Avenue, Miami Shores, FL 33161-6695, USA"
Pauline W. Hoffmann,"Department of Communication, 359 Baldy Hall, University at Buffalo, Buffalo, NY 14260, USA"
Tadeusz Sozanski,"Institute of Sociology, Jagiellonian University, 52 Grodzka, 31-044 Kraków, Poland"
Hans Waege,"Ghent University, Ghent, Belgium"
John Lievens,"Ghent University, Ghent, Belgium"
Ana Salomé García Muñiz,"University of Oviedo, Faculty of Economics, Department of Applied Economics, Avd. Cristo s/n, 33071 Oviedo, Asturias, Spain"
Carmen Ramos Carvajal,"University of Oviedo, Faculty of Economics, Department of Applied Economics, Avd. Cristo s/n, 33071 Oviedo, Asturias, Spain"
Gábor Péli,"University of Groningen, Faculty of Economics, P.O.B. 800, 9700 AV Groningen, The Netherlands"
Karl E. Bauman,"Department of Health Behavior and Health Education, The University of North Carolina at Chapel Hill, USA"
Andrea M. Hussong,"Department of Psychology, The University of North Carolina at Chapel Hill, USA"
Vangie A. Foshee,"Department of Health Behavior and Health Education, The University of North Carolina at Chapel Hill, USA"
Elisabeth L. Terhell,"Faculty of Social Sciences, Vrije Universiteit,Vrije University Amsterdam, De Boelelaan 1081, 1081 HV Amsterdam, The Netherlands"
Marjolein I. Broese van Groenou,"Faculty of Social Sciences, Vrije Universiteit, Vrije University Amsterdam, De Boelelaan 1081, 1081 HV Amsterdam, The Netherlands"
Theo van Tilburg,"Faculty of Social Sciences, Vrije Universiteit, Vrije University Amsterdam, De Boelelaan 1081, 1081 HV Amsterdam, The Netherlands"
Matthijs Kalmijn,"Department of Social and Cultural Sciences, Tilburg University, P.O. Box 90.153, 5000 LE, Tilburg, The Netherlands"
Jeroen K. Vermunt,"Department of Methodology and Statistics, Tilburg University, P.O. Box 90.153, 5000 LE, Tilburg, The Netherlands"
Trevor I. Fenner,"School of Computer Science and Information Systems, Birkbeck College, University of London, London WC1E 7HX, UK"
Mark Levene,"School of Computer Science and Information Systems, Birkbeck College, University of London, London WC1E 7HX, UK"
George Loizou,"School of Computer Science and Information Systems, Birkbeck College, University of London, London WC1E 7HX, UK"
James Stiller,"British Academy Centenary Research Project, School of Biological Sciences, University of Liverpool, Liverpool L69, UK"
John W. McDonald,"Southampton Statistical Sciences Research Institute, University of Southampton, Southampton SO17 1BJ, United Kingdom"
Peter W. F. Smith,"Southampton Statistical Sciences Research Institute, University of Southampton, Southampton SO17 1BJ, United Kingdom"
Jonathan J. Forster,"Southampton Statistical Sciences Research Institute, University of Southampton, Southampton SO17 1BJ, United Kingdom"
Cynthia Giguère,"School of Criminology, Université de Montréal, University of Montreal, C.P. 6128, Succursale Centre-ville, Montreal, Que. H3C-3J7, Canada"
Katia Petit,"School of Criminology, Université de Montréal, University of Montreal, C.P. 6128, Succursale Centre-ville, Montreal, Que. H3C-3J7, Canada"
Mark Handcock,"Department of Statistics, University of Washington, Seattle, USA"
David R. Hunter,"Penn State University, United States"
Steven M. Goodreau,"University of Washington, Department of Anthropology and Center for Studies in Demography and Ecology, Washington, United States"
Frank Tutzauer,"Department of Communication, 359 Baldy Hall, University at Buffalo, Buffalo, NY 14260, USA"
David C. Bell,"Department of Sociology, Indiana University-Purdue University Indianapolis (IUPUI), 425 University Blvd., Indianapolis, IN 46202-5140, United States"
Benedetta Belli-McQueen,"Center for Success and Independence Houston, TX, United States"
Ali Haider,"Karachi, Pakistan"
Peter D. Killworth,"Division for Ocean Circulation, National Oceanography Centre, Southampton, United Kingdom"
James Rennell,"Division for Ocean Circulation, National Oceanography Centre, Southampton, United Kingdom"
Amalya L. Oliver,"Department of Sociology and Anthropology, The Hebrew University, Jerusalem, Israel"
Yuval Kalish,"Department of Sociology and Anthropology, The Hebrew University, Jerusalem, Israel"
Gad Yair,"Department of Sociology and Anthropology, The Hebrew University, Jerusalem, Israel"
Marina Hennig,"Humboldt-Universität zu Berlin, Humboldt University of Berlin, Philosophische Fakultät III, Institut für Sozialwissenschaften, Universitätsstrasse 3b, 10117 Berlin, Germany"
Gabriele Plickert,"NetLab, Department of Sociology, University of Toronto, Canada"
Rochelle R. Côté,"NetLab, Department of Sociology, University of Toronto, Canada"
Diana Mok,"Department of Geography, University of Western Ontario, London, Canada"
Ranu Basu,
Jessica A. Crowe,"Department of Sociology, Washington State University, PO Box 644020, Pullman, WA 99164-4020, United States"
Davide Barrera,"ICS/Department of Sociology, Utrecht University, Heidelberglaan 2, 3584 CS Utrecht, The Netherlands"
Silvia Snidero,"Department of Statistics and Applied Mathematics, University of Torino, Italy"
Bruno Morra,"Department of Otorhinolaryngology, Hospital “S. Giovanni Battista”, Torino, Italy"
Roberto Corradetti,"Department of Statistics and Applied Mathematics, University of Torino, Italy"
Dario Gregori,"Department of Public Health and Microbiology, University of Torino, Via Santona 5 bis, 10126 Torino, Italy"
Sara Y. Del Valle,"D-3, Systems Engineering & Integration (MS B262), Los Alamos National Laboratory, Los Alamos, NM 87545, USA"
James Mac Hyman,"T-7, Mathematical Modeling & Analysis (MS B284), Los Alamos National Laboratory, Los Alamos, NM 87545, USA"
Herbert W. Hethcote,"Department of Applied Mathematical & Computational Sciences, University of Iowa, 14 McLean Hall, Iowa City, IA 52242, USA"
Stephen G. Eubank,"CCS-5, Discrete Simulation Sciences (MS M997), Los Alamos National Laboratory, Los Alamos, NM 87545, USA"
James D. Montgomery,"Department of Sociology, University of Wisconsin - Madison, 1180 Observatory Drive, Madison, WI 53706, United States"
Soong Moon Kang,"Department of Management Science and Innovation, University College London, Gower Street, London WC1E 6BT, UK"
Donald Steiny,"131 Felix Street #15, CA 95060, United States"
Tucker McGrimmon,"University of South Carolina, United States"
Sangick Jeon,"Department of Political Science, Stanford University, 616 Serra Street, Encina Hall West, Room 100, Stanford, CA 94305, United States"
Matthieu Latapy,"LIAFA, CNRS and Université Paris 7, 2 Place Jussieu, 75005 Paris, France"
Clémence Magnien,"CREA, CNRS and Ecole Polytechnique, 5 rue Descartes, 75005 Paris, France"
Nathalie Del Vecchio,"LARGEPA, Université Paris 2, University Paris 2, 13 Avenue Bosquet, 75007 Paris, France"
Lluís Coromina,"Department of Economics, University of Girona, Faculty of Economics, Campus Montilivi, 17071 Girona, Spain"
Jaume Guia,"Department of Organization, Business Management and Product Design, Faculty of Tourism, Pujada dels Alemanys 4, 17071 Girona, Spain"
Brian Carolan,"Department of Education, College of Staten Island, The City University of New York (CUNY), Building 3S-224, 2800 Victory Boulevard, Staten Island, NY 10314, United States"
Gbemisola Adejumo,"University of Waterloo, Canada"
P. Robert Duimering,"University of Waterloo, Canada"
Zhehui Zhong,"University of Waterloo, Canada"
Fengjie Xie,"School of Management, Xi'an Jiaotong University, Xi'an, China"
Wentian Cui,"School of Management, Xi'an Jiaotong University, Xi'an, China"
Rolf Ziegler,"Ludwig-Maximilians-University, University of Munich, Munich, Germany"
Rafael T. Mikolajczyk,"Department of Public Health Medicine, School of Public Health, University of Bielefeld, PO Box 100131, D-33501 Bielefeld, Germany"
Mirjam Kretzschmar,"Department of Public Health Medicine, School of Public Health, University of Bielefeld, PO Box 100131, D-33501 Bielefeld, Germany"
Marie-Thérèse Jourda,"CEPEL-CNRS, Montpellier, France"
Rafaël Stofer,"University of Paris-Dauphine, University Paris Dauphine, CERSO, France"
Béla Janky,"Budapest University of Technology and Economics, Department of Sociology and Communication, Hungary"
George B. Davis,"CASOS, ISRI, SCS, Carnegie Mellon University, 5000 Forbes Avenue, Pittsburgh, PA 15223, USA"
Vasja Vehovar,"University of Ljubljana, Faculty of Social Sciences, Kardeljeva ploščad 5, 1000 Ljubljana, Slovenia"
Katja Lozar Manfreda,"University of Ljubljana, Faculty of Social Sciences, Kardeljeva ploščad 5, 1000 Ljubljana, Slovenia"
Gasper Koren,"University of Ljubljana, Faculty of Social Sciences, Kardeljeva ploščad 5, 1000 Ljubljana, Slovenia"
Charles F. Mann,"Department of Computer Science and Engineering, Southern Methodist University, United States"
David W. Matula,"Department of Computer Science and Engineering, Southern Methodist University, United States"
Eli V. Olinick,"Department of Engineering Management, Information and Systems, Southern Methodist University, United States"
Naomi Braine,"Beth Israel Medical Center and National Development and Research Institute, Inc., United States"
Caroline Acker,"Carnegie Mellon University, United States"
Cullen Goldblatt,"Beth Israel Medical Center, United States"
Huso Yi,"National Development and Research Institute, Inc., United States"
Samuel Friedman,"National Development and Research Institute, Inc., United States"
Don C. DesJarlais,"Beth Israel Medical Center, United States"
Peter Totterdell,"Institute of Work Psychology, University of Sheffield, Sheffield S10 2TN, England, United Kingdom"
David Holman,"Institute of Work Psychology, University of Sheffield, Sheffield S10 2TN, England, United Kingdom"
Amy Hukin,"Institute of Work Psychology, University of Sheffield, Sheffield S10 2TN, England, United Kingdom"
Antonio Páez,"Centre for Spatial Analysis/School of Geography and Earth Sciences, McMaster University, Canada"
