Roy Lindelauf,"Military Operational Art & Science, Netherlands Defense Academy, P.O. Box 90002, 4800 PA Breda, The Netherlands"
Long Doan,"Indiana University, Department of Sociology, 744 Ballantine Hall, 1020 E. Kirkwood Ave., Bloomington, IN 47405, USA"
Jacob Habinek,"University of California - Berkeley, Department of Sociology, United States"
John Levi Martin,"University of Chicago, Department of Sociology, United States"
Benjamin D. Zablocki,"Rutgers University, Department of Sociology, United States"
Michaela Hoffman,"University of Missouri, Columbia, USA"
Douglas L. Steinley,"University of Missouri, Columbia, USA"
Monika Cerinsek,"Hruška d.o.o., Kajuhova 90, 1000 Ljubljana, Slovenia"
Vladimir Batagelj,"Institute of Mathematics, Physics and Mechanics, Jadranska 19, 1000 Ljubljana, Slovenia"
Xiangju Qin,"School of Computer Science & Informatics, University College Dublin, Dublin 4, Ireland"
Pádraig Cunningham,"School of Computer Science & Informatics, University College Dublin, Dublin 4, Ireland"
Michael Salter-Townshend,"Department of Statistics, University of Oxford, 1 South Parks Road, Oxford OX1 3TG, UK"
Jesse Shore,"Boston University, Questrom School of Business, United States"
Benjamin Lubin,"Boston University, Questrom School of Business, United States"
Katrien Fransen,"Department of Kinesiology, KU Leuven, Tervuursevest 101, Box 1500, 3001 Leuven, Belgium"
Stef Van Puyenbroeck,"Department of Kinesiology, KU Leuven, Tervuursevest 101, Box 1500, 3001 Leuven, Belgium"
Todd M. Loughead,"Department of Kinesiology, University of Windsor, 401 Sunset Avenue, Windsor, Ontario, Canada"
Norbert Vanbeselaere,"Center for Social and Cultural Psychology, KU Leuven, Tiensestraat 102, Box 3727, 3000 Leuven, Belgium"
Bert De Cuyper,"Department of Kinesiology, KU Leuven, Tervuursevest 101, Box 1500, 3001 Leuven, Belgium"
Gert Vande Broek,"Department of Kinesiology, KU Leuven, Tervuursevest 101, Box 1500, 3001 Leuven, Belgium"
Filip Boen,"Department of Kinesiology, KU Leuven, Tervuursevest 101, Box 1500, 3001 Leuven, Belgium"
Robin I. M. Dunbar,"Department of Experimental Psychology, University of Oxford, Oxford, UK"
Valerio Arnaboldi,"Department of Experimental Psychology, University of Oxford, Oxford, UK"
Marco Conti,"Institute of Informatics and Telematics of CNR, Pisa, Italy"
Andrea Passarella,"Institute of Informatics and Telematics of CNR, Pisa, Italy"
Weihua An,
Bálint Néray,"Hungarian Academy of Sciences, Centre for Social Sciences, Institute for Sociology, Hungary"
Feng Shi 0005,"Computation Institute, University of Chicago, 5735 S Ellis Ave, Chicago, IL 60637, USA"
Jacob G. Foster,"Department of Sociology, University of California - Los Angeles, 375 Portola Plaza, Los Angeles, CA 90095, USA"
James A. Evans,"Computation Institute, University of Chicago, 5735 S Ellis Ave, Chicago, IL 60637, USA"
Phillip Bonacich,"Department of Sociology, University of California - Los Angeles, CA 90024, United States"
Paulette Lloyd,"AAAS Fellow and Foreign Affairs Analyst, U.S. Department of State, 2201C Street NW, Washington, DC 20524, United States"
Edward Bishop Smith,"Kellogg School of Management, Northwestern University, United States"
Kyle Emich,"Alfred Lerner College of Business and Economics, University of Delaware, United States"
C. Prem Sankar,"Department of Futures Studies, University of Kerala, Kariavattom, Kerala 695 581, India"
K. Asokan 0002,"Department of Mathematics, College of Engineering, Thiruvananthapuram, Kerala 695 016, India"
K. Satheesh Kumar,"Department of Futures Studies, University of Kerala, Kariavattom, Kerala 695 581, India"
Duy Vu,"University of Melbourne, VIC 3010, Australia"
Andreas Tutic,"Universität Leipzig, University of Leipzig, Institut für Soziologie, Beethovenstraße 15, 04107 Leipzig, Germany"
Harald Wiese,"Universität Leipzig, University of Leipzig, Wirtschaftswissenschaftliche Fakultät, Grimmaische Straße 12, 04109 Leipzig, Germany"
J. Ashwin Rambaran,"Department of Sociology and Interuniversity Center for Social Science Theory and Methodology (ICS), University of Groningen, Grote Rozenstraat 31, 9712 TG Groningen, The Netherlands"
Jan Kornelis Dijkstra,"Department of Sociology and Interuniversity Center for Social Science Theory and Methodology (ICS), University of Groningen, Grote Rozenstraat 31, 9712 TG Groningen, The Netherlands"
Antonius H. N. Cillessen,"Department of Developmental Psychology and Behavioural Science Institute (BSI), Radboud University, Montessorilaan 3, 6500 HE Nijmegen, The Netherlands"
Samira Malek Mohamadi Golsefid,"Department of Industrial Engineering, Amirkabir University of Technology (Polytechnic of Tehran), P.O. Box 15875-4413, Tehran, Iran"
Mohammad Hossein Fazel Zarandi,"Department of Industrial Engineering, Amirkabir University of Technology (Polytechnic of Tehran), P.O. Box 15875-4413, Tehran, Iran"
Susan Bastani,"Department of Sociology, Alzahra University, 19938-93973 Tehran, Iran"
Charles J. Gomez,"Stanford University, 485 Lasuen Mall, Stanford, CA 94305, United States"
Paolo Parigi,"Stanford University, 450 Serra Mall, Building 120, Room 132, Stanford, CA 94305, United States"
Elise Cappella,"Department of Applied Psychology, New York University, United States"
Helian Xu,"School of Economy and Trade, Hunan University, China"
Balázs Kovács,"Yale University, USA"
Chengwei Liu,"University of Warwick, UK"
Beata Lopaciuk-Gonczaryk,"Faculty of Economic Sciences, University of Warsaw, Poland"
Shanfeng Wang,"Key Laboratory of Intelligent Perception and Image Understanding of Ministry of Education, Xidian University, Xi'an, Shaanxi Province 710071, China"
Maoguo Gong,"Key Laboratory of Intelligent Perception and Image Understanding of Ministry of Education, Xidian University, Xi'an, Shaanxi Province 710071, China"
Haifeng Du,"Center for Administration and Complexity Science, Xi'an Jiaotong University, Xi'an, Shaanxi Province 710049, China"
Lijia Ma,"Key Laboratory of Intelligent Perception and Image Understanding of Ministry of Education, Xidian University, Xi'an, Shaanxi Province 710071, China"
Qiguang Miao,"School of Computer, Xidian University, Xi'an, Shaanxi Province 710071, China"
Wei Du 0004,"Center for Administration and Complexity Science, Xi'an Jiaotong University, Xi'an, Shaanxi Province 710049, China"
Emily Hoagland,"Cornell University, Department of Sociology, United States"
Eleonora Patacchini,"Sapienza Universitá di Roma, Sapienza University of Rome, Italy"
Yves Zenou,"Stockholm University and Research Institute of Industrial Economics (IFN), Sweden"
Ning Wang 0013,"University of Oxford, United Kingdom"
Hanno Kruse,"University of Mannheim/MZES (Mannheim Centre for European Social Research) , A5 6, 68131 Mannheim, Germany"
Sanne Smith,"Department of Sociology/ICS, Utrecht University, Padualaan 14, 3584 CH Utrecht, The Netherlands"
Ineke Maas,"Department of Sociology/ICS, Utrecht University, Padualaan 14, 3584 CH Utrecht, The Netherlands"
Sadamori Koujaku,"Graduate School of Information Science and Technology, Hokkaido University, Japan"
Ichigaku Takigawa,"Graduate School of Information Science and Technology, Hokkaido University, Japan"
Mineichi Kudo,"Graduate School of Information Science and Technology, Hokkaido University, Japan"
Hideyuki Imai,"Graduate School of Information Science and Technology, Hokkaido University, Japan"
Linton C. Freeman,"Institute of Mathematical Behavioral Sciences, University of California - Irvine, United States"
Andreas Flache,"University of Groningen/ICS, Netherlands"
Anke Munniksma,"University of Amsterdam, Netherlands"
Hongzhong Deng,"Department of Management, College of Information Systems and Management, National University of Defense Technology, China"
Peter Abell,"Managerial Economics and Strategy Group, Department of Management, London School Economics, London School of Economics and Political Science and Political Science, London School of Economics and Political Science, United Kingdom"
Ofer Engel,"Centre for the Analysis of Time Series, London School Economics and Political Science, London School of Economics and Political Science, United Kingdom"
Jun Wu 0004,"Department of Management, College of Information Systems and Management, National University of Defense Technology, China"
Yuejin Tan,"Department of Management, College of Information Systems and Management, National University of Defense Technology, China"
Richard A. Benton,"University of Illinois, United States"
Molly E. Brown,"Department of Geographical Sciences, University of Maryland - College Park, College Park, MD 20740, United States"
Monica Ihli,"University of Tennessee, Knoxville, TN 37996, United States"
Oscar Hendrick,"Science Systems and Applications Inc., NASA Goddard Space Flight Center, Code 618, Greenbelt, MD 20771, United States"
Sabrina Delgado-Arias,"Science Systems and Applications Inc., NASA Goddard Space Flight Center, Code 618, Greenbelt, MD 20771, United States"
Vanessa M. Escobar,"Science Systems and Applications Inc., NASA Goddard Space Flight Center, Code 618, Greenbelt, MD 20771, United States"
Peter Griffith,"Science Systems and Applications Inc., NASA Goddard Space Flight Center, Code 618, Greenbelt, MD 20771, United States"
Gerald C. Kane,"Department of Information Systems, Carroll School of Management, Boston College, United States"
Eva Huszti,"Faculty of Health, University of Debrecen, Sóstói u. 2-4, H-4400 Nyíregyháza, Hungary"
Ildikó Barna,"Faculty of Social Sciences, Eötvös Loránd University, Pázmány Péter sétány 1/a, H-1117 Budapest, Hungary"
Paola Zappa,"Faculty of Economics and Social Network Analysis Research Center (SoNAR), University of Lugano, Switzerland"
Julia Brennecke,"Centre for Transformative Innovation, Faculty of Business and Law, Swinburne University of Technology, PO Box 218, Mail H25, Hawthorn, VIC 3122, Australia"
Julien Brailly,"Institut de Recherche Interdisciplinaire en Sciences Sociales (IRISSO), Université Paris-Dauphine, University Paris-Dauphine, Place du Maréchal de Lattre de Tassigny, 75016 Paris, France"
Guillaume Favre,"Institut de Recherche Interdisciplinaire en Sciences Sociales (IRISSO), Université Paris-Dauphine, University Paris-Dauphine, Place du Maréchal de Lattre de Tassigny, 75016 Paris, France"
Josiane Chatellet,"Institut de Recherche Interdisciplinaire en Sciences Sociales (IRISSO), Université Paris-Dauphine, University Paris-Dauphine, Place du Maréchal de Lattre de Tassigny, 75016 Paris, France"
Andrew J. Slaughter,"US Army Research Institute for the Behavioral and Social Sciences, USA"
Philippa Pattison,"The University of Sydney, Australia"
Francesca Pallotti,"University of Greenwich, UK"
Laura Prota,"University of Salerno, Department of Statistics and Economics, Via Giovanni Paolo II, 132, 84084 Fisciano, SA, Italy"
Yunsong Chen,"Nanjing University, People's Republic of China"
David Melamed,"The Ohio State University, United States"
Brent Simpson,"University of South Carolina, United States"
Frank van Tubergen,"Utrecht University, Department of Sociology, Padualaan 14, 3584 CH Utrecht, Netherlands"
Obaid Ali Al-Modaf,"Department of Sociology & Social Work, King Abdul Aziz University, Abdullah Suleiman Street, Al Jamiaa District 80200, Saudi Arabia"
Nora F. Almosaed,"Department of Sociology & Social Work, King Abdul Aziz University, Abdullah Suleiman Street, Al Jamiaa District 80200, Saudi Arabia"
Mohammed Ben Said Al-Ghamdi,"Department of Sociology & Social Work, King Abdul Aziz University, Abdullah Suleiman Street, Al Jamiaa District 80200, Saudi Arabia"
Michele L. Barnes,"Department of Natural Resources and Environmental Management, University of Hawaii at Manoa, 1910 East-West Rd., Sherman 101, Honolulu, HI 96822, USA"
Kolter Kalberg,"Joint Institute for Marine and Atmospheric Research, University of Hawaii at Manoa, 1000 Pope Rd., Marine Science Building 312, Honolulu, HI 96822, USA"
Minling Pan,"Pacific Islands Fisheries Science Center, NOAA National Marine Fisheries Service, 1845 Wasp Blvd, Building 176, Honolulu, HI 96818, USA"
PingSun Leung,"Department of Natural Resources and Environmental Management, University of Hawaii at Manoa, 1910 East-West Rd., Sherman 101, Honolulu, HI 96822, USA"
Tso-Jung Yen,"Institute of Statistical Science, Academia Sinica, Taiwan"
Cheng Wang 0010,"Department of Sociology, University of Notre Dame, United States"
Rupa Jose,"Department of Psychology and Social Behavior, University of California - Irvine, United States"
Cynthia M. Lakon,"Program in Public Health, University of California - Irvine, United States"
Zeynep Ertem,"Department of Industrial and Systems Engineering, Texas A&M University, College Station, TX 77843-3131, United States"
Alexander Veremyev,"Department of Industrial and Systems Engineering, University of Florida, Gainesville, FL 32611-6595, United States"
Sergiy Butenko,"Department of Industrial and Systems Engineering, Texas A&M University, College Station, TX 77843-3131, United States"
Sebastian Bähr,"Chair of Sociology and Empirical Social Research – Sociology of the Labour Market, Department of Business and Economics, University of Erlangen-Nuremberg, Findelgasse 7/9, D-90402 Nuremberg, Germany"
Martin Abraham,"Chair of Sociology and Empirical Social Research – Sociology of the Labour Market, Department of Business and Economics, University of Erlangen-Nuremberg, Findelgasse 7/9, D-90402 Nuremberg, Germany"
Olivier Godechot,"Sciences Po, MaxPo, France"
Eugen Pircalabelu,"ORSTAT and Leuven Statistics Research Center, KU Leuven, Naamsestraat 69, 3000 Leuven, Belgium"
Gerda Claeskens,"ORSTAT and Leuven Statistics Research Center, KU Leuven, Naamsestraat 69, 3000 Leuven, Belgium"
Robert A. Hanneman,"University of California - Riverside, United States"
Jürgen Pfeffer,"Technical University of Munich/Bavarian School of Public Policy, Germany"
Avner Bar-Hen,"MAP5, UFR de Mathématiques et Informatique, Université Paris Descartes, University Paris Descartes, 45 rue des Saints-Pères, 75270 Paris cedex 06, France"
Pierre Barbillon,"AgroParisTech/UMR INRA MIA 518, 16 rue Claude Bernard, 75231 Paris Cedex 05, France"
Sophie Donnet,"AgroParisTech/UMR INRA MIA 518, 16 rue Claude Bernard, 75231 Paris Cedex 05, France"
Eric Giannella,"University of California - Berkeley, 410 Barrows Hall, Berkeley, CA 94720-1980, United States"
Anna L. Smith,"Department of Statistics, The Ohio State University, United States"
Catherine A. Calder,"Department of Statistics, The Ohio State University, United States"
Christopher R. Browning,"Department of Sociology, The Ohio State University, United States"
Martin Hilbert,"University of California - Davis, Department of Communication, Kerr Hall 369, Davis, CA 95616, United States"
Poong Oh,"University of Pennsylvania, Annenberg School for Communication, 3620 Walnut Street, Philadelphia, PA 19104, United States"
Peter Monge,"University of Southern California, Annenberg School of Communication, Watt Way, Los Angeles, CA 90007, United States"
Beate Völker,"University of Amsterdam, Department of Sociology, Nieuwe Achtergracht 166, 1018 WV Amsterdam, The Netherlands"
Ruben De Cuyper,"Netherlands Institute for the Study of Crime and Law enforcement (NSCR), The Netherlands"
Gerald Mollenhorst,"Utrecht University, The Netherlands"
Anja Dirkzwager,"Netherlands Institute for the Study of Crime and Law enforcement (NSCR), The Netherlands"
Peter van der Laan,"Netherlands Institute for the Study of Crime and Law enforcement (NSCR), The Netherlands"
Paul Nieuwbeerta,"Netherlands Institute for the Study of Crime and Law enforcement (NSCR), The Netherlands"
Marlène Sapin,"Swiss Center of Expertise in Social Sciences (FORS), University of Lausanne, Switzerland"
Eric D. Widmer,"Department of Sociology, University of Geneva, Switzerland"
Katia Iglesias,"Centre for the Understanding of Social Processes (MAPS), University of Neuchâtel, Switzerland"
Mario Luis Small,"Harvard University, United States"
Christopher Sukhu,"University of Chicago, United States"
Satyam Mukherjee,"Northwestern Institute on Complex Systems (NICO), Northwestern University Evanston, United States"
Matthew Dabkowski,"Department of Systems and Industrial Engineering, University of Arizona, Tucson, United States"
Neng Fan,"Department of Systems and Industrial Engineering, University of Arizona, Tucson, United States"
Ronald L. Breiger,"School of Sociology, University of Arizona, Tucson, United States"
Justus Uitermark,"Department of Sociology, University of Amsterdam, PO Box 15508, 1001 NA Amsterdam, The Netherlands"
Vincent A. Traag,"CWTS, Leiden University, P.O. Box 905, 2300 AX Leiden, The Netherlands"
Michael Mäs,"University of Groningen, The Netherlands"
Karl-Dieter Opp,"University of Leipzig, Germany"
Michele Starnini,"Departament de Física Fonamental,  Universitat de Barcelona, University of Barcelona, University of Barcelona, Martí i Franques 1, 08028 Barcelona, Spain"
Andrea Baronchelli,"Department of Mathematics, City University London, Northampton Square, London EC1V 0HB, UK"
Romualdo Pastor-Satorras,"Departament de Física i Enginyeria Nuclear, Universitat Politècnica de Catalunya, Polytechnic University of Catalonia, Campus Nord B4, 08034 Barcelona, Spain"
Vincent Chua,"National University of Singapore, Department of Sociology, 11 Arts Link, #04-27, Singapore 117570, Singapore"
Mathew Mathews,"Lee Kuan Yew School of Public Policy, 1C Cluny Road House 5, Singapore 259599, Singapore"
Yi Cheng Loh,"University of Cambridge, Department of Sociology, United Kingdom"
Pádraig Mac Carron,"SENRG, Department of Experimental Psychology, University of Oxford, OX1 3UD United Kingdom"
Kimmo Kaski,"Department of Computer Science, Aalto University School of Science, P.O. Box 15500, Espoo, Finland"
Robin Dunbar,"SENRG, Department of Experimental Psychology, University of Oxford, OX1 3UD United Kingdom"
Alex D. Stivala,"Melbourne School of Psychological Sciences, The University of Melbourne, Australia"
David A. Rolls,"Melbourne School of Psychological Sciences, The University of Melbourne, Australia"
Christina Prell,"Geographical Sciences Department, MD, USA"
Kuishuang Feng,"Geographical Sciences Department, University of Maryland - College Park, College Park, MD, USA"
George Wood,"Department of Sociology, University of Oxford, UK"
Emmanuel Lazega,"Institut d'Etudes Politiques de Paris, Centre de Sociologie des Organisations, 19 rue Amélie, 75007 Paris, France"
Sandrine Casenaz,"CSO, Sciences Po, Paris, France"
Matilde Massó,"Department of Sociology, Political Science and Public Administration, Universidade da Coruña, Campus Elviña s/n, Facultade de Socioloxía, 15071 A Coruña, Spain"
Alejandro Arnulfo Ruiz-León,"Laboratorio de Redes, Instituto de Investigaciones en Matemáticas Aplicadas y en Sistemas, Universidad Nacional Autónoma de México, National Autonomous University of Mexico, Ciudad Universitaria, 04510 Ciudad de Mexico, Mexico"
Tobias H. Stark,"Utrecht University/ICS, Padualaan 14, 3584 CH Utrecht, The Netherlands"
Jon A. Krosnick,"Stanford University, 450 Serra Mall, Stanford, CA 94305, United States"
Anja Znidarsic,"University of Maribor, Faculty of Organizational Sciences, Kidričeva 55a, 4000 Kranj, Slovenia"
Anuska Ferligoj,"University of Ljubljana, Faculty of Social Sciences, Kardeljeva ploščad 5, 1000 Ljubljana, Slovenia"
Lucas G. Drouhot,"Cornell University, United States"
Jeffrey A. Smith,"University of Nebraska-Lincoln, United States"
James Moody,"Duke University, United States"
Jonathan H. Morgan,"Duke University, United States"
Sandra Cristina Oliveira,"Universidade Estadual Paulista, 17602-496 Tupã, SP, Brazil"
Juliana Cobre,"Universidade de São Paulo, USP, 13560-970 São Carlos, SP, Brazil"
Taiane de Paula Ferreira,"Universidade Estadual Paulista, 17602-496 Tupã, SP, Brazil"
Domenico Brunetto,"MOX, Department of Mathematics, Politecnico di Milano, Milan, Italy"
Nicholas Harrigan,"School of Social Sciences, Singapore Management University, 90 Stamford Road, Level 4, Singapore 178903, Singapore"
Janice Yap,"School of Social Sciences, Singapore Management University, 90 Stamford Road, Level 4, Singapore 178903, Singapore"
Patrick S. Park,"Department of Sociology, 323 Uris Hall, Cornell University, Ithaca, NY 14853, United States"
Yong-Hak Kim,"Department of Sociology Widang, Hall #502, Yonsei University, 50 Yonsei-ro, Seodaemun-gu, Seoul 120-749, South Korea"
Holly B. Shakya,"School of Medicine, University of California - San Diego, 9500 Gilman Dr., La Jolla, CA 92093, United States"
Nicholas A. Christakis,"Yale Institute for Network Science, PO Box 208263, New Haven, CT 06520, United States"
James H. Fowler,"School of Medicine, University of California - San Diego, 9500 Gilman Dr., La Jolla, CA 92093, United States"
Vicki Stover Hertzberg,"Department of Biostatistics and Bioinformatics, Emory University, Atlanta, GA, United States"
Jason Baumgardner,"Department of Biostatistics and Bioinformatics, Emory University, Atlanta, GA, United States"
C. Christina Mehta,"Department of Biostatistics and Bioinformatics, Emory University, Atlanta, GA, United States"
Lisa K. Elon,"Department of Biostatistics and Bioinformatics, Emory University, Atlanta, GA, United States"
George Cotsonis,"Department of Biostatistics and Bioinformatics, Emory University, Atlanta, GA, United States"
Douglas W. Lowery-North,"Department of Emergency Medicine, Emory University, Atlanta, GA, United States"
Joel Martí,"Department of Sociology, Centre d'Estudis Sociològics sobre la Vida Quotidiana i el Treball (QUIT), Institut d'Estudis del Treball (IET), Universitat Autònoma de Barcelona, Autonomous University of Barcelona, Spain"
Mireia Bolíbar,"Institute for Sociology, University of Bremen, Germany"
Carlos Lozares,"Department of Sociology, Centre d'Estudis Sociològics sobre la Vida Quotidiana i el Treball (QUIT), Institut d'Estudis del Treball (IET), Universitat Autònoma de Barcelona, Autonomous University of Barcelona, Spain"
Stefano Nasini,"IESEG School of Management (LEM CNRS 9221), Lille/Paris, France"
Víctor Martínez-de-Albéniz,"IESE Business School, University of Navarra, Barcelona, Spain. Supported by the European Research Council –Ref. ERC-2011-StG 283300-REACTOPS and by the Spanish Ministry of Economics and Competitiveness (Ministerio de Economía y Competitividad) – Ref. ECO2014-59998-P"
Tahereh Dehdarirad,"University of Barcelona, Barcelona, Spain"
Dino Dittrich,"Department of Methodology and Statistics, Tilburg University, Postbus 90153, 5000 LE Tilburg, The Netherlands"
Roger Th. A. J. Leenders,"Department of Organization Studies, Tilburg University, The Netherlands"
Joris Mulder,"Department of Methodology and Statistics, Tilburg University, Postbus 90153, 5000 LE Tilburg, The Netherlands"
Karl Finger,"Institute for Quantitative Business and Economics Research (QBER), University of Kiel, Heinrich-Hecht-Platz 9, 24118 Kiel, Germany"
Thomas Lux,"Department of Economics, University of Kiel, Olshausenstr. 40, 24118 Kiel, Germany"
Gregory Lee Phillips II,"Northwestern University, Feinberg School of Medicine, Department of Medical Social Sciences, 625N. Michigan Ave., Chicago, IL 60611, USA"
Patrick Janulis,"Northwestern University, Feinberg School of Medicine, Department of Medical Social Sciences, 625N. Michigan Ave., Chicago, IL 60611, USA"
Brian S. Mustanski,"Northwestern University, Feinberg School of Medicine, Department of Medical Social Sciences, 625N. Michigan Ave., Chicago, IL 60611, USA"
Michelle Birkett,"Northwestern University, Feinberg School of Medicine, Department of Medical Social Sciences, 625N. Michigan Ave., Chicago, IL 60611, USA"
J. Santana,"Stanford University, Department of Sociology, 450 Serra Mall, Building 120, Room 160, Stanford, CA 94305, United States"
Raine Hoover,"Stanford University, Computer Science Department, 353 Serra Mall, Stanford, CA 94305, United States"
Meera Vengadasubbu,"Stanford University, Computer Science Department, 353 Serra Mall, Stanford, CA 94305, United States"
Jasper L. de Bie,"Institute for Criminal Law & Criminology, Leiden Law School, Leiden University, Leiden, The Netherlands"
Christianne J. de Poot,"Research and Documentation Centre, Ministry of Security & Justice, The Hague, The Netherlands"
Joshua D. Freilich,"Criminal Justice Department and the Criminal Justice PhD Program at John Jay College, City University of New York, United States"
Steven M. Chermak,"School of Criminal Justice at Michigan State University, East Lansing, United States"
José Atilano Pena-López,"Applied Economics Department, University of A Coruña, Spain"
Jose Manuel Sánchez-Santos,"Applied Economics Department, University of A Coruña, Spain"
Charles Weko,"Headquarters, Department of the Army, United States Army, United States"
Yunpeng Zhao,"Department of Statistics, George Mason University, United States"
James D. Wilson,"Department of Mathematics and Statistics, University of San Francisco, United States"
Matthew J. Denny,"Department of Political Science and Social Data Analytics, Pennsylvania State University, United States"
Shankar Bhamidi,"Department of Statistics and Operations Research, University of North Carolina, United States"
Renáta Hosnedlová,"LISST, CNRS and University of Toulouse, France"
Stephanie Thiemichen,"Institut für Statistik Ludwigs-Maximilians-Universität München, University of Munich Germany"
Göran Kauermann,"Institut für Statistik Ludwigs-Maximilians-Universität München, University of Munich Germany"
Nicolò Pecora,"Department of Economics and Social Sciences, Catholic University, Via E. Parmense, 84, 29122 Piacenza, Italy"
Bernhard Leidner,"University of Massachusetts Amherst, United States"
Michela Del Vicario,"CSSLab, IMT School for Advanced Studies, Lucca, Italy"
