Emma S. Spiro,"Department of Sociology, University of California - Irvine, CA 92697, United States"
Todd E. Malinick,"Energy Market Innovations, Inc., United States"
David B. Tindall,"Department of Sociology, and Department of Forest Resources Management, University of British Columbia, Canada"
Mario Diani,"ICREA-Universitat Pompeu Fabra, Barcelona, Spain"
Tore Opsahl,"Imperial College Business School, Imperial College London, London, United Kingdom"
Jan Kleinnijenhuis,"VU University Amsterdam, Vrije University Amsterdam, The Netherlands"
Wouter de Nooy,"ASCoR, University of Amsterdam, The Netherlands"
Anne-Marie Niekamp,"Department of Sexual Health, Infectious Diseases and Environmental Health, South Limburg Public Health Service, PO Box 2022, 6160 HA Geleen, The Netherlands"
Liesbeth A. G. Mercken,"Department of Health Promotion, School of Public Health and Primary Care (CAPHRI), Maastricht University, PO Box 616, 6200 MD Maastricht, The Netherlands"
Christian J. P. A. Hoebe,"Department of Sexual Health, Infectious Diseases and Environmental Health, South Limburg Public Health Service, PO Box 2022, 6160 HA Geleen, The Netherlands"
Nicole H. T. M. Dukers-Muijrers,"Department of Sexual Health, Infectious Diseases and Environmental Health, South Limburg Public Health Service, PO Box 2022, 6160 HA Geleen, The Netherlands"
Guido Conaldi,"Centre for Business Network Analysis, University of Greenwich (UK), Park Row, London SE10 9LS, United Kingdom"
Mengxiao Zhu,"School of Communication and Information, Rutgers University, New Brunswick, USA"
Yun Huang 0001,"Department of Industrial Engineering and Management Sciences, Northwestern University, Evanston, USA"
Noshir S. Contractor,"Department of Industrial Engineering and Management Sciences, Northwestern University, Evanston, USA"
Vanina Jasmine Torló,"Department of Systems Management and Strategy, The Business School, University of Greenwich, London, United Kingdom"
Hwai-Chung Ho,"Institute of Statistical Science, Academia Sinica, Taipei 115, Taiwan"
Hsiu Man Chen,"Institute of Statistical Science, Academia Sinica, Taipei 115, Taiwan"
Francois Collet,"ESADE Business School, Avenue Pedralbes 60-62, Barcelona 08034, Spain"
Peter Hedström,"Institute for Futures Studies, Box 591, SE-101 31 Stockholm, Sweden"
Binh Phan,"Department of Strategy and Logistics, BI Norwegian Business School, Nydalsveien 37, 0484 Oslo, Norway"
Kenth Engø-Monsen,"Telenor Group, Research and Future Studies, Snarøyveien 30, N-1331 Fornebu, Norway"
Øystein D. Fjeldstad,"Department of Strategy and Logistics, BI Norwegian Business School, Nydalsveien 37, 0484 Oslo, Norway"
Jennifer B. Unger,"Institute for Prevention Research, Department of Preventive Medicine, Keck School of Medicine, University of Southern California, Los Angeles, CA, United States"
Daniel W. Soto,"Institute for Prevention Research, Department of Preventive Medicine, Keck School of Medicine, University of Southern California, Los Angeles, CA, United States"
Daniella Meeker,"Rand Corporation, Santa Monica, CA, United States"
Alexia Gaudeul,"Max Planck Institute of Economics, Jena, Germany"
Caterina Giannetti,"Department of Economics, University of Bologna, Italy"
Jennifer L. Merluzzi,"A.B. Freeman School of Business, Tulane University, 7 McAlister Drive, New Orleans, LA 70118, United States"
Andrea Austin,"Department of Biostatistics, Brown University, Box G-121S-7, Providence, RI 02912, United States"
Crystal Linkletter,"MathWorks, 3 Apple Hill Dr, Natick, MA 01760, United States"
Zhijin Wu,"Department of Biostatistics, Brown University, Box G-121S-7, Providence, RI 02912, United States"
Adriana P. A. van Beek,"NIVEL: Netherlands Institute for Health Services Research, PO BOX 1568, 3500 BN Utrecht, The Netherlands"
Cordula Wagner,"NIVEL: Netherlands Institute for Health Services Research, PO BOX 1568, 3500 BN Utrecht, The Netherlands"
Dinnus H. M. Frijters,"EMGO+, Department of Nursing Home Medicine, VU University Medical Center, Van der Boechorststraat 7, 1081 BT Amsterdam, The Netherlands"
Miel W. Ribbe,"EMGO+, Department of Nursing Home Medicine, VU University Medical Center, Van der Boechorststraat 7, 1081 BT Amsterdam, The Netherlands"
Peter P. Groenewegen,"NIVEL: Netherlands Institute for Health Services Research, PO BOX 1568, 3500 BN Utrecht, The Netherlands"
Danching Ruan,"Hong Kong Baptist University, Hong Kong"
Gina Lai,"Hong Kong Baptist University, Hong Kong"
Vittorio Fuccella,"Department of Informatics, University of Salerno, Italy"
Susanna Zaccarin,"Department of Economics, Business, Mathematics and Statistics “B. de Finetti”, University of Trieste, Italy"
Xiumei Zhu,"Brian Lamb School of Communication, Purdue University, Beering Hall of Liberal Arts and Education, Room 2114, 100 North University Street, West Lafayette, IN 47907, United States"
Sang Eun Woo,"Department of Psychological Sciences, Purdue University, 703 Third Street, West Lafayette, IN 47907, United States"
Caitlin Porter,"Department of Psychological Sciences, Purdue University, 703 Third Street, West Lafayette, IN 47907, United States"
Michael Brzezinski,"Office of International Students and Scholars, Purdue University, Young Hall, Room #120, 155 S. Grant Street, West Lafayette, IN 47907-2114, United States"
Camille Roth,"Centre Marc Bloch, CNRS/MAEE/HU, Friedrichstr 191, D-10117 Berlin, Germany"
Floriana Gargiulo,"Centre d'analyse et de mathématique sociales, CNRS/EHESS, 190 avenue de France, F-75013 Paris, France"
Arnaud Bringé,"Institut National d'Etudes Démographiques, 133 boulevard Davout, F-75011 Paris, France"
Klaus Hamberger,"Laboratoire d'Anthropologie Sociale, Collège de France/CNRS/EHESS, 52 Rue du Cardinal Lemoine, F-75005 Paris, France"
Michael McBride,"Department of Economics, University of California - Irvine, United States"
Michael Caldara,"Department of Economics, University of California - Irvine, United States"
Shigemi Kagawa,"Faculty of Economics, Kyushu University, Fukuoka, Japan"
Shunsuke Okamoto,"Faculty of Economics, Kyushu University, Fukuoka, Japan"
Sangwon Suh,"Bren School of Environmental Science and Management, The University of California - Santa Barbara, USA"
Yasushi Kondo,"Faculty of Political Science and Economics, Waseda University, Tokyo, Japan"
Keisuke Nansai,"Research Center for Material Cycles and Waste Management, National Institute for Environmental Studies, Tsukuba, Japan"
James Nastos,"Department of Computer Science, University of British Columbia Okanagan, Kelowna, British Columbia, Canada V1V 1V7"
Yong Gao 0001,"Department of Computer Science, University of British Columbia Okanagan, Kelowna, British Columbia, Canada V1V 1V7"
Theo A. Arentze,"Faculty of the Built environment, Urban Planning Group, Eindhoven University of Technology, The Netherlands"
Matthias Kowald,"Institute for Transport Planning and Systems (IVT), ETH Zurich, 8093 Zurich, Switzerland"
Kay W. Axhausen,"Institute for Transport Planning and Systems (IVT), ETH Zurich, 8093 Zurich, Switzerland"
Enrico Bozzo,"Department of Mathematics and Computer Science, University of Udine, Via delle Scienze 206, 33100 Udine, Italy"
Massimo Franceschet,"Department of Mathematics and Computer Science, University of Udine, Via delle Scienze 206, 33100 Udine, Italy"
Nicholas Charron,"Department of Political Science, The Quality of Government Institute, University of Gothenburg, Sweden"
Paul D. McLean,"Rutgers University, 26 Nichol Avenue, New Brunswick, NJ 08901, United States"
Joeri M. Mol,"Department of Management and Marketing, The University of Melbourne, Melbourne, Australia"
Klarita Gërxhani,"Department of Sociology, Amsterdam Centre for Inequality Studies, University of Amsterdam, Oudezijds Achterburgwal 185, 1012 DK Amsterdam, The Netherlands"
Jordi Brandts,"Department of Business Economics, U. Autònoma de Barcelona, Institut d'Anàlisi Econòmica (CSIC) and Barcelona GSE, Campus UAB, 08193 Bellaterra, Barcelona, Spain"
Arthur Schram,"CREED, Amsterdam School of Economics, University of Amsterdam, Roetersstraat 11, 1018 WB Amsterdam, The Netherlands"
Rami Puzis,"University of Maryland - College Park Institute for Advanced Computer Studies (UMIACS), 2119 AVW Building, College Park, MD 20742, USA"
Manish Purohit,"University of Maryland - College Park Institute for Advanced Computer Studies (UMIACS), 2119 AVW Building, College Park, MD 20742, USA"
V. S. Subrahmanian,"University of Maryland - College Park Institute for Advanced Computer Studies (UMIACS), 2119 AVW Building, College Park, MD 20742, USA"
Jacob Dijkstra,"ICS/University of Groningen; Department of Sociology, Grote Rozenstraat 31, 9712 TG Groningen, The Netherlands"
Marcel A. L. M. van Assen,"Tilburg University; Tilburg School of Social and Behavioral Sciences, Department of Methodology and Statistics, Warandelaan 2, 5037 AB Tilburg, The Netherlands"
Sara Geven,"Department of Sociology, Utrecht University, Padualaan 14, 3584 CH Utrecht, The Netherlands"
Jeroen Weesie,"Department of Sociology, Utrecht University, Padualaan 14, 3584 CH Utrecht, The Netherlands"
Lindsey Trimble O'Connor,"California State University Channel Islands, United States"
Juliette Stehlé,"Aix Marseille Université, CNRS, CPT, UMR 7332, 13288 Marseille, France"
François Charbonnier,"ENSAE, 92245 Malakoff cedex, France"
Tristan Picard,"ENSAE, 92245 Malakoff cedex, France"
Ciro Cattuto,"Data Science Laboratory, Institute for Scientific Interchange (ISI) Foundation, Torino, Italy"
Alain Barrat,"Aix Marseille Université, CNRS, CPT, UMR 7332, 13288 Marseille, France"
Ryan M. Acton,"Department of Sociology, University of Massachusetts, Amherst, United States"
Eran Shor,"Department of Sociology, McGill University, Room 713, Leacock Building, 855 Sherbrooke Street West, Montreal, Quebec H3A 2T7, Canada"
David J. Roelfs,"Department of Sociology, University of Louisville, Louisville, KY, USA"
Tamar Yogev,"Faculty of Management, University of Haifa, Haifa, Israel"
Rosa M. V. Figueiredo,"CIDMA, Department of Mathematics, University of Aveiro, 3810-193 Aveiro, Portugal"
Gisele Moura,"Department of Mathematics and Statistics, Rio de Janeiro State University, 20550-900 Rio de Janeiro, Brazil"
Rebecca Nash,"Simon Fraser University, 8888 University Drive, Burnaby, BC V5A 1S6, Canada"
Rebecca Jenkinson,"Centre for Population Health, Burnet Institute, 85 Commercial Road, Melbourne, VIC 3004, Australia"
Philippa E. Pattison,"Melbourne School of Psychological Sciences, University of Melbourne, VIC 3010, Australia"
Rachel Sacks-Davis,"Centre for Population Health, Burnet Institute, 85 Commercial Road, Melbourne, VIC 3004, Australia"
Galina Daraganova,"Melbourne School of Psychological Sciences, University of Melbourne, VIC 3010, Australia"
Margaret Hellard,"Centre for Population Health, Burnet Institute, 85 Commercial Road, Melbourne, VIC 3004, Australia"
Emma McBryde,"Department of Medicine (RMH), University of Melbourne, VIC 3010, Australia"
Yoshihisa Kashima,"Melbourne School of Psychological Sciences, The University of Melbourne, Australia"
Dean Lusher,"Faculty of Life and Social Sciences, Swinburne University of Technology, Australia"
Leonie J. Pearson,"Melbourne Sustainable Society Institute, The University of Melbourne, Australia"
Craig Pearson,"Melbourne Sustainable Society Institute, The University of Melbourne, Australia"
Werner Raub,"Department of Sociology/ICS, Utrecht University, Netherlands"
Scott D. McClurg,"Southern Illinois University, United States', 'Northeastern University and Harvard University, United States"
David Lazer,"Northeastern University and Harvard University, United States"
Tobias Heinrich,"University of South Carolina, United States"
Eric Schoon,"School of Sociology, University of Arizona, Tucson, AZ 85721, United States"
Victor Asal,"Department of Political Science, Rockefeller College of Public Affairs and Policy, University at Albany, Albany, NY 12222, United States"
R. Karl Rethemeyer,"Department of Public Administration and Policy, Rockefeller College of Public Affairs and Policy, University at Albany, Albany, NY 12222, United States"
Lauren Rhue,"New York University, United States"
Arun Sundararajan,"New York University, United States"
Laura Sartori,"Università di Bologna, University of Bologna, Italy"
Michael T. Heaney,"Organizational Studies Program and Department of Political Science, University of Michigan, 722 Dennison Building, 500 Church Street, Ann Arbor, MI 48109, United States"
Justin H. Kirkland,"University of Houston, 447 Phillip Guthrie Hoffman Hall, Houston, TX 77204, United States"
Justin H. Gross,"University of North Carolina at Chapel Hill, United States"
Robert Huckfeldt,"University of California - Davis, United States"
Matthew T. Pietryka,"University of California - Davis, United States"
Jack Reilly,"New College of Florida, United States"
Daniel P. Enemark,"University of Southern California, United States"
Mathew D. McCubbins,"Marshall School of Business, Gould School of Law, Department of Political Science, University of Southern California, United States"
Nicholas Weller,"Department of Political Science, School of International Relations, University of Southern California, United States"
Jason Bello,"Department of Management, London School of Economics and Political Science, UK"
Meredith Rolfe,"Department of Management, London School of Economics and Political Science, UK"
Anand E. Sokhey,"Department of Political Science, University of Colorado, United States"
Paul A. Djupe,"Department of Political Science, Denison University, United States"
Jason M. Smith,"Department of Economics and Finance, Jon M. Huntsman School of Business, Utah State University, Logan, UT 84322, United States"
Virginie Kidwell-Lopez,"Department of Organizations, Strategy and International Management, Naveen Jindal School of Management, The University of Texas at Dallas, Richardson, TX 75080-3021, United States"
Jennifer Golbeck,"Human-Computer Interaction Lab, College of Information Studies, University of Maryland - College Park, College Park, MD, United States"
Derek L. Hansen,"Information Technology, Brigham Young University, Provo, UT, United States"
Richard Heidler,"Department for Education and Social Sciences, Bergische University Wuppertal, Gaußstr. 20, 42097 Wuppertal, Germany"
Florian Eßer,"Institute for Social Pedagogy and Organization Sciences, University of Hildesheim, Lübeckerstraße 3, 31141 Hildesheim, Germany"
Mayukh Dass,"Department of Marketing, Rawls College of Business, MS2101, Texas Tech University, Lubbock, TX 79409, United States"
Dawn Iacobucci,"Owen Graduate School of Management, Vanderbilt University, 401 21st Avenue South, Nashville, TN 37203, United States"
Miruna Petrescu-Prahova,"Department of Health Services, University of Washington, Seattle, WA, USA"
Duy Quang Vu,"Department of Mathematics and Statistics, University of Melbourne, Melbourne, Australia"
Tarik Crnovrsanin,"Department of Computer Science, 2063 Kemper Hall, University of California - Davis, One Shields Avenue, Davis, CA 95616, United States"
Chris Muelder,"Department of Computer Science, 2063 Kemper Hall, University of California - Davis, One Shields Avenue, Davis, CA 95616, United States"
Kwan-Liu Ma,"Department of Computer Science, 2063 Kemper Hall, University of California - Davis, One Shields Avenue, Davis, CA 95616, United States"
Henk Flap,"Utrecht University, The Netherlands"
Brandon Brooks,"Department of Media and Information, Michigan State University, United States"
Bernie Hogan,"Oxford Internet Institute, University of Oxford, United Kingdom"
Nicole B. Ellison,"School of Information, University of Michigan, United States"
Cliff Lampe,"School of Information, University of Michigan, United States"
Jessica Vitak,"College of Information Studies, University of Maryland - College Park, United States"
Alejandro Rivero,"Institute for Biocomputation and Physics of Complex Systems, University of Zaragoza, Spain"
Maria Rosaria D'Esposito,"Department of Economics and Statistics, University of Salerno, Via Ponte don Melillo, 84084 Fisciano (SA), Italy"
Domenico De Stefano,"Department of Economics, Ca' Foscari University of Venice, Cannaregio 873, 30121 Venezia, Italy"
J. C. Barnes,"The University of Texas at Dallas, School of Economic, Political & Policy Sciences, 800 West Campbell Road, Richardson, TX 75080, United States"
Kevin M. Beaver,"Florida State University, College of Criminology and Criminal Justice, 634 West Call Street, Hecht House, Tallahassee, FL 32306, United States"
Michael TenEyck,"The University of Texas at Dallas, School of Economic, Political & Policy Sciences, 800 West Campbell Road, Richardson, TX 75080, United States"
Peter Pal Zubcsek,"Warrington College of Business Administration, University of Florida, Gainesville, FL 32611, United States"
Imran Chowdhury,"Lubin School of Business, Pace University, New York, NY 10038, United States"
Zsolt Katona,"Haas School of Business, University of California - Berkeley, Berkeley, CA 94720-1900, United States"
Murray Aitkin,"Department of Mathematics and Statistics, University of Melbourne, Victoria, Australia"
Brian Francis,"Department of Mathematics and Statistics, Lancaster University, Lancaster LA1 4YL, United Kingdom"
Wei Wang 0211,"University of Central Florida, United States"
Eric J. Neuman,"University of Illinois at Urbana-Champaign, United States"
Daniel A. Newman,"University of Illinois at Urbana-Champaign, United States"
Jeremy M. Koster,"Department of Anthropology, University of Cincinnati, Cincinnati, OH 45221, United States"
George Leckie,"Centre for Multilevel Modelling, Graduate School of Education, University of Bristol, 2 Priory Road, Bristol BS8 1TX, United Kingdom"
David Tuckett,"UCL Centre for the Study of Decision-Making Uncertainty, Faculty of Brain Sciences, University College London, United Kingdom"
Robert Elliott Smith,"UCL Centre for the Study of Decision-Making Uncertainty, Faculty of Brain Sciences, University College London, United Kingdom"
Rickard Nyman,"UCL Centre for the Study of Decision-Making Uncertainty, Faculty of Brain Sciences, University College London, United Kingdom"
Alfredo Jose Morales,"Grupo de Sistemas Complejos, Departamento de Física y Mecánica, Universidad Politécnica de Madrid, Polytechnic University of Madrid, ETSI Agrónomos, 28040 Madrid, Spain"
Javier Borondo,"Grupo de Sistemas Complejos, Departamento de Física y Mecánica, Universidad Politécnica de Madrid, Polytechnic University of Madrid, ETSI Agrónomos, 28040 Madrid, Spain"
Juan Carlos Losada,"Grupo de Sistemas Complejos, Departamento de Física y Mecánica, Universidad Politécnica de Madrid, Polytechnic University of Madrid, ETSI Agrónomos, 28040 Madrid, Spain"
Rosa M. Benito,"Grupo de Sistemas Complejos, Departamento de Física y Mecánica, Universidad Politécnica de Madrid, Polytechnic University of Madrid, ETSI Agrónomos, 28040 Madrid, Spain"
Noah E. Friedkin,"Department of Sociology, University of California - Santa Barbara, United States"
Eugene C. Johnsen,"Department of Mathematics, University of California - Santa Barbara, United States"
David Savage,"School of CS&IT, RMIT University, GPO Box 2476, Melbourne, Victoria 3001, Australia"
Xiuzhen Zhang,"School of CS&IT, RMIT University, GPO Box 2476, Melbourne, Victoria 3001, Australia"
Xinghuo Yu 0001,"School of CS&IT, RMIT University, GPO Box 2476, Melbourne, Victoria 3001, Australia"
Pauline Chou,"School of CS&IT, RMIT University, GPO Box 2476, Melbourne, Victoria 3001, Australia"
Qingmai Wang,"School of CS&IT, RMIT University, GPO Box 2476, Melbourne, Victoria 3001, Australia"
Andrew Shipilov,"INSEAD, Boulevard de Constance, Fontainebleau 77300, France"
Valentyn Kalnysh,"Ukrainian Institute of Public Health, Kyiv, Ukraine"
Yuri Kalnysh,"Ukrainian Academy of Public Service, Kyiv, Ukraine"
Zachary Neal,"Psychology Department, 316 Physics Road, Michigan State University, East Lansing, MI 48824, United States"
Angela Bohn,"Institute for Statistics and Mathematics, Austria"
Christian Buchta,"Institute for Service Marketing and Tourism, Austria"
Kurt Hornik,"Institute for Statistics and Mathematics, Austria"
Patrick Mair,"Institute for Statistics and Mathematics, Austria"
Ferenc Szidarovszky,"Reliasoft Corporation, 1450 South Eastside Loop, Tucson, United States"
Angelo Mondaini Calvão,"School of Applied Mathematics, Getulio Vargas Foundation,Rio de Janeiro, RJ, Brazil"
Crysttian Arantes Paixão,"School of Applied Mathematics, Getulio Vargas Foundation,Rio de Janeiro, RJ, Brazil"
Flávio Codeço Coelho,"School of Applied Mathematics, Getulio Vargas Foundation,Rio de Janeiro, RJ, Brazil"
Renato Rocha Souza,"School of Applied Mathematics, Getulio Vargas Foundation,Rio de Janeiro, RJ, Brazil"
Sam Schramski,"Post-Graduate Program in Amazonian Society and Culture, Federal University of Amazonas, Brazil"
Mark Caudell,"Department of Anthropology, Washington State University, Pullman, WA 99164-4910, United States"
Thomas Rotolo,"Department of Sociology, Washington State University, Pullman, WA 99164-4910, United States"
Mulye Grima,"School of Behavioral Sciences, Hawassa University, Hawassa, SNNPRS 95502, Ethiopia"
Vincent G. Moscardelli,"Department of Political Science, University of Connecticut, United States"
Brian F. Schaffner,"Department of Political Science, University of Massachusetts Amherst, United States"
Michael S. Kowal,"Department of Political Science, University of Massachusetts Amherst, United States"
Martin Hällsten,"Department of Sociology, Stockholm University, Sweden"
Christofer R. Edling,"Department of Sociology, Lund University, Sweden"
Jens Rydgren,"Department of Sociology, Stockholm University, Sweden"
David E. Eagle,"Department of Sociology, Duke University, PO Box 90088, Durham, NC 27708-0088, United States"
Rae Jean Proeschold-Bell,"Duke Global Health Institute, Duke University, PO Box 90392, Durham, NC 27708-0392, United States"
Nadine Tamburrini,"School of Biological Sciences, Royal Holloway University of London, Egham TW20 0EX, UK"
Marco Cinnirella,"Department of Psychology, Royal Holloway University of London, Egham TW20 0EX, UK"
Vincent A. A. Jansen,"School of Biological Sciences, Royal Holloway University of London, Egham TW20 0EX, UK"
John Bryden,"School of Biological Sciences, Royal Holloway University of London, Egham TW20 0EX, UK"
Vontrese Deeds Pamphile,"Northwestern University, United States"
Peter McMahan,"University of Chicago, United States"
Xianbi Huang,"School of Social Sciences and Communications, La Trobe University, Melbourne, Victoria 3086, Australia"
Lei Zhang 0042,"Department of Sociology, University of Minnesota, 267 19th Avenue South, Minneapolis, MN 55455, United States"
Robert Faris,"University of California - Davis, United States"
Alexander G. Nikolaev,"Department of Industrial and Systems Engineering, 438 Bell Hall, State University of New York at Buffalo, Buffalo, NY 14260, United States"
Raihan Razib,"Department of Industrial and Systems Engineering, 438 Bell Hall, State University of New York at Buffalo, Buffalo, NY 14260, United States"
Ashwin Kucheriya,"Department of Industrial and Systems Engineering, 438 Bell Hall, State University of New York at Buffalo, Buffalo, NY 14260, United States"
Pieter-Paul Verhaeghe,"Department of Sociology, Ghent University, Belgium"
Koen Van der Bracht,"Department of Sociology, Ghent University, Belgium"
Bart Van de Putte,"Department of Sociology, Ghent University, Belgium"
Cuihua Shen,"Department of Communication, University of California - Davis, USA"
Wenhong Chen,"Department of Radio-TV-Film, University of Texas at Austin, USA"
Jason Owen-Smith,"University of Michigan, Department of Sociology, #3001 500 S. State St., Ann Arbor, MI 48109-1382, United States"
Natalie C. Cotton-Nessler,"Bentley University, Department of Management, 175 Forest Street, Waltham, MA 02452, United States"
Helena Buhr,"The Northwestern Institute on Complex Systems (NICO), 600 Foster Street, Evanston, IL 60208-4057, United States"
Maria Grazia Vigliotti,"Department of Computing, Imperial College London, South Kensington Campus SW7 2BZ, UK"
Chris Hankin,"Institute of Security and Department of Computing, Imperial College London, South Kensington Campus SW7 2BZ, UK"
Lorien Jasny,"National Socio-Environmental Synthesis Center, 1 Park Place, Suite 300, Annapolis, MD 21401, United States"
Matthew Johnson 0002,"School of Engineering and Computer Science, Durham University, United Kingdom"
Daniël Paulusma,"School of Engineering and Computer Science, Durham University, United Kingdom"
Erik Jan van Leeuwen,"Max Planck Institute, Max-Planck Institut für Informatik, Saarbrücken, Germany"
Todd C. Lehmann,"University of Michigan, United States"
James A. Rolfsen,"Creighton University, United States"
Terry D. Clark,"Creighton University, United States"
Ling Heng Henry Wong,"Victorian Funds Management Corporation & Department of Finance, The University of Melbourne, Australia"
André F. Gygax,"Department of Finance, The University of Melbourne, Australia"
Yuli Patrick Hsieh,"Program on Digital Technology and Society, Survey Research Division, RTI International, United States"
Bart Husslage,"Department of Mathematics, Fontys University of Applied Sciences, P.O. Box 90900, 5000 GA Tilburg, The Netherlands"
Peter Borm,"CentER and Department of Econometrics and Operations Research, Tilburg University, P.O. Box 90153, 5000 LE Tilburg, The Netherlands"
Twan Burg,"CentER and Department of Econometrics and Operations Research, Tilburg University, P.O. Box 90153, 5000 LE Tilburg, The Netherlands"
Herbert Hamers,"CentER and Department of Econometrics and Operations Research, Tilburg University, P.O. Box 90153, 5000 LE Tilburg, The Netherlands"
